{"generated":true,"exactTaskSources":true,"expectedOutcome":"UNSUPPORTED_DYNAMIC_CONSTRUCTION","tasks":[{"sourceId":"discover-versions","semanticCapability":"CUSTOM","nodeKind":"Task"},{"sourceId":"test-versions","semanticCapability":"CUSTOM","nodeKind":"Task"}],"requiredRelations":[{"source":"discover-versions","target":"test-versions","kind":"VALUE","channel":"versions"}],"forbiddenOrdering":[],"requiredFeatures":["dynamic-matrix"],"expectedDiagnostics":["REAL_WORLD_DYNAMIC_MATRIX_NOT_REPRESENTED"]}
