{"generated":true,"exactTaskSources":true,"expectedOutcome":"SUPPORTED_WITH_BINDING","tasks":[{"sourceId":"initialize","semanticCapability":"CUSTOM","nodeKind":"Task"},{"sourceId":"apply","semanticCapability":"PROVISION","nodeKind":"Task"},{"sourceId":"verify","semanticCapability":"VERIFY","nodeKind":"Task"}],"requiredRelations":[{"source":"initialize","target":"apply","kind":"ORDERING"},{"source":"initialize","target":"apply","kind":"VALUE","channel":"initialized_configuration"},{"source":"apply","target":"verify","kind":"ORDERING"},{"source":"apply","target":"verify","kind":"VALUE","channel":"provisioned_state"}],"forbiddenOrdering":[],"requiredFeatures":["infrastructure-provision"],"expectedDiagnostics":[]}
