{"generated":true,"exactTaskSources":true,"expectedOutcome":"SEMANTIC_ONLY","tasks":[{"sourceId":"A","semanticCapability":"CUSTOM","nodeKind":"Task"},{"sourceId":"B","semanticCapability":"CUSTOM","nodeKind":"Task"},{"sourceId":"C","semanticCapability":"CUSTOM","nodeKind":"Task"},{"sourceId":"D","semanticCapability":"CUSTOM","nodeKind":"Task"}],"requiredRelations":[{"source":"A","target":"B","kind":"ORDERING"},{"source":"A","target":"C","kind":"ORDERING"},{"source":"B","target":"D","kind":"ORDERING"},{"source":"C","target":"D","kind":"ORDERING"}],"forbiddenOrdering":[{"source":"B","target":"C"},{"source":"C","target":"B"}],"requiredFeatures":["fan-in"],"expectedDiagnostics":["REAL_WORLD_REQUIRED_PARALLELISM_SERIALIZED"]}
