{"generated":true,"exactTaskSources":true,"expectedOutcome":"SUPPORTED_WITH_BINDING","tasks":[{"sourceId":"restore-state","semanticCapability":"RESTORE","nodeKind":"Task"},{"sourceId":"verify-restored-state","semanticCapability":"VERIFY","nodeKind":"Task"}],"requiredRelations":[{"source":"restore-state","target":"verify-restored-state","kind":"ORDERING"},{"source":"restore-state","target":"verify-restored-state","kind":"VALUE","channel":"restored_state"}],"forbiddenOrdering":[],"requiredFeatures":[],"expectedDiagnostics":[]}
