{"generated":true,"exactTaskSources":true,"expectedOutcome":"SUPPORTED_WITH_BINDING","tasks":[{"sourceId":"create-backup","semanticCapability":"BACKUP","nodeKind":"Task"},{"sourceId":"verify-backup","semanticCapability":"VERIFY","nodeKind":"Task"}],"requiredRelations":[{"source":"create-backup","target":"verify-backup","kind":"ORDERING"},{"source":"create-backup","target":"verify-backup","kind":"VALUE","channel":"backup_artifact"}],"forbiddenOrdering":[],"requiredFeatures":[],"expectedDiagnostics":[]}
