{"generated":true,"exactTaskSources":true,"expectedOutcome":"UNSUPPORTED_DYNAMIC_CONSTRUCTION","tasks":[{"sourceId":"discover","semanticCapability":"CUSTOM","nodeKind":"Task"},{"sourceId":"deploy","semanticCapability":"DEPLOY","nodeKind":"Task"}],"requiredRelations":[{"source":"discover","target":"deploy","kind":"ORDERING"},{"source":"discover","target":"deploy","kind":"VALUE","channel":"discovered_components"}],"forbiddenOrdering":[],"requiredFeatures":["runtime-generated-plan"],"expectedDiagnostics":["REAL_WORLD_RUNTIME_PLAN_NOT_REPRESENTED"]}
