{"generated":true,"exactTaskSources":true,"expectedOutcome":"SUPPORTED_WITH_BINDING","tasks":[{"sourceId":"produce-artifact","semanticCapability":"CUSTOM","nodeKind":"Task"},{"sourceId":"consume-artifact","semanticCapability":"CUSTOM","nodeKind":"Task"}],"requiredRelations":[{"source":"produce-artifact","target":"consume-artifact","kind":"VALUE","channel":"package_bundle"}],"forbiddenOrdering":[],"requiredFeatures":["artifact-identity"],"expectedDiagnostics":[]}
