{"generated":true,"exactTaskSources":true,"expectedOutcome":"SUPPORTED_WITH_BINDING","tasks":[{"sourceId":"extract","semanticCapability":"DATA_TRANSFORM","nodeKind":"Task"},{"sourceId":"transform","semanticCapability":"DATA_TRANSFORM","nodeKind":"Task"},{"sourceId":"load","semanticCapability":"DATA_TRANSFORM","nodeKind":"Task"}],"requiredRelations":[{"source":"extract","target":"transform","kind":"ORDERING"},{"source":"extract","target":"transform","kind":"VALUE","channel":"orders"},{"source":"transform","target":"load","kind":"ORDERING"},{"source":"transform","target":"load","kind":"VALUE","channel":"order_total"}],"forbiddenOrdering":[],"requiredFeatures":["data-transform"],"expectedDiagnostics":[]}
