{"generated":true,"exactTaskSources":true,"expectedOutcome":"SUPPORTED_WITH_BINDING","tasks":[{"sourceId":"approval","semanticCapability":"APPROVE","nodeKind":"Approval"},{"sourceId":"release","semanticCapability":"CUSTOM","nodeKind":"Task"}],"requiredRelations":[{"source":"approval","target":"release","kind":"VALUE","channel":"release_approved"}],"forbiddenOrdering":[],"requiredFeatures":["typed-human-input"],"expectedDiagnostics":[]}
